{
  "schemaVersion": 1,
  "role": "supporting-generator-r2-static-checks",
  "sourceFreezeHead": "7c6936b97a54f13d1ceb3272f810cf51d28a34f1",
  "r1BaseHead": "5ab1c93894aebcfb2ffad50604e942a10c3655f7",
  "scopeBaseHead": "846e8e07614a97dcebd9d2cd2bdb678f971651fd",
  "checkedHead": "5ab1c93894aebcfb2ffad50604e942a10c3655f7",
  "node": "v22.22.0",
  "platform": "darwin",
  "nativeWindowsExecuted": false,
  "productRuntimeExecuted": false,
  "syntaxChecks": 4,
  "schemaValidated": true,
  "finalControls": 14,
  "allControlsPassed": true,
  "bounds": {
    "totalMs": 600000,
    "caseMs": 40000,
    "cleanupMs": 3000,
    "operationMs": 10000,
    "smokeChildMs": 7000,
    "smokePs": 38,
    "totalPs": 76,
    "outputBytes": 65536,
    "traceBytes": 524288,
    "attributeBytes": 16384
  },
  "nativeAttributeScriptExact": true,
  "frozenPathsUnchanged": true,
  "workflowUnchangedFromR1": true,
  "originalEvidenceInventory": [
    {
      "path": "docs/test-reports/windows-release-diagnosis-20261008/native-findings-r1/original/ci-37808814119-original.json",
      "sha256": "d1aa019f7acddef8936f75a955e0fe35c6dd63e908c93afef2afe999b124cabb",
      "bytes": 2195
    },
    {
      "path": "docs/test-reports/windows-release-diagnosis-20261008/native-findings-r1/original/ci-37808814119-original.log",
      "sha256": "683729d92640bd6ed41ea9822f79ba22b5c4db9fcc503e23b5ea1732b14e819a",
      "bytes": 37987
    },
    {
      "path": "docs/test-reports/windows-release-diagnosis-20261008/native-findings-r1/original/run-37808814119-original/windows-native-ci-20261008/diagnostic-result.json",
      "sha256": "216a52334c063705efb3edf29f147df8dd5377d9614f340f53afc4bcaf4a820c",
      "bytes": 215
    },
    {
      "path": "docs/test-reports/windows-release-diagnosis-20261008/native-findings-r1/original/run-37808814119-original/windows-native-ci-20261008/provenance.json",
      "sha256": "b8743c0c7ca51fddd2a82c75deecb4233e74edd53f736019b8afc4aaa4d257ae",
      "bytes": 619
    },
    {
      "path": "docs/test-reports/windows-release-diagnosis-20261008/native-findings-r1/original/run-37808814119-original/windows-release-diagnosis-20261008/native-output-1791476860167/binding.cleanup.json",
      "sha256": "0761e57eeede7821e17dacc650b4fba4782b1ead6bbe335a35b82f77b56ca5a3",
      "bytes": 156
    },
    {
      "path": "docs/test-reports/windows-release-diagnosis-20261008/native-findings-r1/original/run-37808814119-original/windows-release-diagnosis-20261008/native-output-1791476860167/binding.json",
      "sha256": "9b40ed1eef2c47ceacda434507ca64199b742b082e758c5f8fc901015abb00ed",
      "bytes": 514
    },
    {
      "path": "docs/test-reports/windows-release-diagnosis-20261008/native-findings-r1/original/run-37808814119-original/windows-release-diagnosis-20261008/native-output-1791476860167/binding.trace-health.json",
      "sha256": "d45dee74495952e42bf54d63c1b422fa9f5a12894e25eaa5118ffe940a53f281",
      "bytes": 317
    },
    {
      "path": "docs/test-reports/windows-release-diagnosis-20261008/native-findings-r1/original/run-37808814119-original/windows-release-diagnosis-20261008/native-output-1791476860167/binding.trace.jsonl",
      "sha256": "75b8cc48596a119ba80c4b34df8cd4ca9bb4dbe16448e4f86361b9fb675f3368",
      "bytes": 5993
    },
    {
      "path": "docs/test-reports/windows-release-diagnosis-20261008/native-findings-r1/original/run-37808814119-original/windows-release-diagnosis-20261008/native-output-1791476860167/confirmation.cleanup.json",
      "sha256": "24bd1768c12b191cfc47786db7becdbb707177a79ca32e7a67cdc05e0327225e",
      "bytes": 156
    },
    {
      "path": "docs/test-reports/windows-release-diagnosis-20261008/native-findings-r1/original/run-37808814119-original/windows-release-diagnosis-20261008/native-output-1791476860167/confirmation.json",
      "sha256": "b033f25eb034872c1f16598165ee37d2df74b36f56c7bf78e487ae4217b94f4a",
      "bytes": 516
    },
    {
      "path": "docs/test-reports/windows-release-diagnosis-20261008/native-findings-r1/original/run-37808814119-original/windows-release-diagnosis-20261008/native-output-1791476860167/confirmation.trace-health.json",
      "sha256": "22c42770ebaa1f00061542838a03011850fadf60a6b2f6936fc3562f2f4c6690",
      "bytes": 317
    },
    {
      "path": "docs/test-reports/windows-release-diagnosis-20261008/native-findings-r1/original/run-37808814119-original/windows-release-diagnosis-20261008/native-output-1791476860167/confirmation.trace.jsonl",
      "sha256": "f3e727a503c06dca32bd338cf184a4db85aae1d857df316a08cffbbc45f8e37d",
      "bytes": 6006
    },
    {
      "path": "docs/test-reports/windows-release-diagnosis-20261008/native-findings-r1/original/run-37808814119-original/windows-release-diagnosis-20261008/native-output-1791476860167/healthy.cleanup.json",
      "sha256": "192e487957afca105103fbb14a8f1927217c0f26f37d328e5ff8d4551f0f69e1",
      "bytes": 156
    },
    {
      "path": "docs/test-reports/windows-release-diagnosis-20261008/native-findings-r1/original/run-37808814119-original/windows-release-diagnosis-20261008/native-output-1791476860167/healthy.json",
      "sha256": "ca909083aaea7924b9890caab8aea3bc30723743684fd85e4e1089ae0399a0cd",
      "bytes": 579
    },
    {
      "path": "docs/test-reports/windows-release-diagnosis-20261008/native-findings-r1/original/run-37808814119-original/windows-release-diagnosis-20261008/native-output-1791476860167/healthy.trace-health.json",
      "sha256": "ff62cf6c5ea5f1cf68b2eef30f3d76feaae0e47b15cdb1632a311a20c1f73f0e",
      "bytes": 317
    },
    {
      "path": "docs/test-reports/windows-release-diagnosis-20261008/native-findings-r1/original/run-37808814119-original/windows-release-diagnosis-20261008/native-output-1791476860167/healthy.trace.jsonl",
      "sha256": "112b97c532faea764595ef0bde27cfc1f25c044b71ccd2bc91253d917a140c23",
      "bytes": 7197
    },
    {
      "path": "docs/test-reports/windows-release-diagnosis-20261008/native-findings-r1/original/run-37808814119-original/windows-release-diagnosis-20261008/native-output-1791476860167/parent.cleanup.json",
      "sha256": "385aef189cfc76d11967a1188abb83c589a9011b36a27afbaacb64f0f37b744e",
      "bytes": 157
    },
    {
      "path": "docs/test-reports/windows-release-diagnosis-20261008/native-findings-r1/original/run-37808814119-original/windows-release-diagnosis-20261008/native-output-1791476860167/parent.json",
      "sha256": "5059cb7dad47ee1c306c32f108cca1a4ffb89bb0f47ed277b91a83c1ce0830a6",
      "bytes": 829
    },
    {
      "path": "docs/test-reports/windows-release-diagnosis-20261008/native-findings-r1/original/run-37808814119-original/windows-release-diagnosis-20261008/native-output-1791476860167/parent.trace-health.json",
      "sha256": "b5e45680fda7a75b5a33960637f543dde22e5f3b7fc5e469c030df36d6b16b54",
      "bytes": 354
    },
    {
      "path": "docs/test-reports/windows-release-diagnosis-20261008/native-findings-r1/original/run-37808814119-original/windows-release-diagnosis-20261008/native-output-1791476860167/parent.trace.jsonl",
      "sha256": "4696c0c3cd7fd45d4734a7030fe1571c8f5e602e3b1711deeb64a8f4320081ea",
      "bytes": 10464
    },
    {
      "path": "docs/test-reports/windows-release-diagnosis-20261008/native-findings-r1/original/run-37808814119-original/windows-release-diagnosis-20261008/native-output-1791476860167/privacy.cleanup.json",
      "sha256": "0622d5c2bd0585599d154260e933666f7c18871305074e857e0d8ff0e0b74773",
      "bytes": 156
    },
    {
      "path": "docs/test-reports/windows-release-diagnosis-20261008/native-findings-r1/original/run-37808814119-original/windows-release-diagnosis-20261008/native-output-1791476860167/privacy.json",
      "sha256": "a2e93ecba64c4bbc9807910049084eb47ddd7a51a1cf012d59b5429404a56982",
      "bytes": 1202
    },
    {
      "path": "docs/test-reports/windows-release-diagnosis-20261008/native-findings-r1/original/run-37808814119-original/windows-release-diagnosis-20261008/native-output-1791476860167/privacy.trace-health.json",
      "sha256": "a678c0f411773b4c4d66eeec01605aed71c0bb7720589fa8062ccf6a701a3c97",
      "bytes": 280
    },
    {
      "path": "docs/test-reports/windows-release-diagnosis-20261008/native-findings-r1/original/run-37808814119-original/windows-release-diagnosis-20261008/native-output-1791476860167/privacy.trace.jsonl",
      "sha256": "3a817bf8c08a6a950016e564b751e25903e74aa62619ac10751234ab1ba230e5",
      "bytes": 7223
    },
    {
      "path": "docs/test-reports/windows-release-diagnosis-20261008/native-findings-r1/original/run-37808814119-original/windows-release-diagnosis-20261008/native-output-1791476860167/subprocess.cleanup.json",
      "sha256": "c02318af6fb47bb16f0c26212a1b399061d0f73e495a9c61ea554923d6f2189e",
      "bytes": 195
    },
    {
      "path": "docs/test-reports/windows-release-diagnosis-20261008/native-findings-r1/original/run-37808814119-original/windows-release-diagnosis-20261008/native-output-1791476860167/subprocess.json",
      "sha256": "9b4ea96bfa2ac9d64ab0095662362f561e6455dac10caebc4d9d4f4eadf9f5d1",
      "bytes": 1967
    },
    {
      "path": "docs/test-reports/windows-release-diagnosis-20261008/native-findings-r1/original/run-37808814119-original/windows-release-diagnosis-20261008/native-output-1791476860167/subprocess.trace-health.json",
      "sha256": "e50405a5157b8e955fb657bc859d94a06f7dc153c2dc073b9a59395f4dcc2657",
      "bytes": 791
    },
    {
      "path": "docs/test-reports/windows-release-diagnosis-20261008/native-findings-r1/original/run-37808814119-original/windows-release-diagnosis-20261008/native-output-1791476860167/subprocess.trace.jsonl",
      "sha256": "ea2cd0438db07dc85672ce7e4dfdc9254dddedf23db0a83d6ab8a4d19be14598",
      "bytes": 13678
    },
    {
      "path": "docs/test-reports/windows-release-diagnosis-20261008/native-findings-r1/original/run-37808814119-original/windows-release-diagnosis-20261008/native-output-1791476860167/workflow.cleanup.json",